{
  "schema_version": 1,
  "profile_id": "synthetic-example",
  "display_name": "Synthetic Example",
  "evidence_version": "synthetic-v1",
  "role_families": [
    "Construction Project Management",
    "Construction Superintendent / Field Execution",
    "Facilities / Infrastructure",
    "Project Controls"
  ],
  "preferred_locations": [
    "Louisiana",
    "Pecan Island"
  ],
  "strong_match_threshold": 70,
  "capabilities": [
    {
      "name": "Synthetic construction project delivery evidence",
      "keywords": [
        "construction",
        "project management",
        "field execution"
      ],
      "evidence": {
        "source": "synthetic-profile",
        "claim_id": "SYN-001",
        "statement": "Fictional example evidence for tests and documentation only."
      }
    },
    {
      "name": "Synthetic project controls evidence",
      "keywords": [
        "project controls",
        "schedule",
        "cost"
      ],
      "evidence": {
        "source": "synthetic-profile",
        "claim_id": "SYN-002",
        "statement": "Fictional example evidence for tests and documentation only."
      }
    }
  ],
  "eligibility": {
    "work_authorization": {
      "status": "unknown",
      "evidence": null
    },
    "itar": {
      "status": "unknown",
      "evidence": null
    },
    "degree": {
      "status": "unknown",
      "evidence": null
    }
  },
  "qualification_evidence": []
}
